{
  "$schema": "https://json-schema.org/draft/2020-12/schema",
  "$id": "https://ripdock.org/schemas/runtime-capabilities.schema.json",
  "title": "runtime.capabilities",
  "description": "Runtime capability announcement.",
  "type": "object",
  "required": [
    "type",
    "protocol_version",
    "streaming",
    "tools",
    "interrupt",
    "multimodal",
    "attachments",
    "background_tasks",
    "settings",
    "agents",
    "agent_settings",
    "slash_commands",
    "generated_artifacts",
    "runtime_transfers",
    "artifact_http_downloads",
    "artifact_ack"
  ],
  "properties": {
    "type": { "const": "runtime.capabilities" },
    "protocol_version": { "const": "1" },
    "streaming": { "type": "boolean" },
    "tools": { "type": "boolean" },
    "interrupt": { "type": "boolean" },
    "multimodal": { "type": "boolean" },
    "attachments": { "type": "boolean" },
    "background_tasks": { "type": "boolean" },
    "settings": { "type": "boolean" },
    "agents": { "type": "boolean" },
    "agent_settings": { "type": "boolean" },
    "slash_commands": { "type": "boolean" },
    "generated_artifacts": { "type": "boolean" },
    "runtime_transfers": { "type": "boolean" },
    "artifact_http_downloads": { "type": "boolean" },
    "artifact_ack": { "type": "boolean" }
  },
  "additionalProperties": false
}
