{
  "type": "runtime.capabilities",
  "protocol_version": "1",
  "streaming": true,
  "tools": true,
  "interrupt": true,
  "multimodal": true,
  "attachments": true,
  "background_tasks": true,
  "settings": true,
  "agents": true,
  "agent_settings": true,
  "slash_commands": true,
  "generated_artifacts": true,
  "runtime_transfers": true,
  "artifact_http_downloads": true,
  "artifact_ack": true
}
